Unnamed: 0,题目分类,题型,题干,选项,答案
162,专业题库,01单选题,依据变电安规，任何运行中的星形接线设备的中性点，应视为（    ）,A-不带电设备|B-带电设备|C-运行设备|D-停运设备,B
163,专业题库,01单选题,依据变电安规，装、拆接地线导体端均应使用绝缘棒和戴（　　）。,A-绝缘手套|B-线手套|C-护目镜|D-橡胶手套,A
164,专业题库,01单选题,依据变电安规，高压开关柜内手车开关拉出后，隔离带电部位的挡板封闭后（    ），并设置“止步，高压危险！”的标示牌。,A-禁止开启|B-必须专人看守|C-立即接地|D-应填写在运行记录内,A
165,专业题库,01单选题,依据变电安规，装、拆接地线时，人体不得（　　）接地线或未接地的导线，以防止触电。,A-靠近|B-碰触|C-临近|D-贴近,B
166,专业题库,01单选题,依据变电安规，在配电装置上，接地线应装在该装置导电部分的规定地点，应去除这些地点的油漆或绝缘层，并划有（    ）标记。,A-红色|B-绿色|C-黑色|D-黄色,C
167,专业题库,01单选题,依据变电安规，在室外高压设备上工作，若室外配电装置的大部分设备停电，只有个别地点保留有带电设备而其他设备无触及带电导体的可能时，可以在带电设备四周装设全封闭围栏，围栏上悬挂适当数量的（    ）标示牌，标示牌应朝向围栏外面。,A-“从此进出！” |B-“在此工作！”|C-“止步，高压危险！”|D-“禁止攀登，高压危险！”,C
168,专业题库,01单选题,依据变电安规，降压变电站全部停电时，应将（    ）的部分接地短路，其余部分不必每段都装设接地线或合上接地刀闸（装置）。,A-电源侧|B-各个可能来电侧|C-负荷侧|D-来电侧,B
169,专业题库,01单选题,依据变电安规，在工作地点设置（    ）的标示牌。,A-“在此工作！”|B-“从此进出！”|C-“止步，高压危险！” |D-“禁止合闸，有人工作！”,A
170,专业题库,01单选题,依据变电安规，对由于设备原因，接地刀闸（装置）与检修设备之间连有断路器（开关），在接地刀闸（装置）和断路器（开关）合上后，在断路器（开关）操作把手上，应悬挂（    ）的标示牌。,A-“禁止合闸，有人工作！”|B-“禁止分闸！”|C-“禁止合闸，线路有人工作！”|D-“止步，高压危险！”,B
171,专业题库,01单选题,依据变电安规，所有配电装置的适当地点，均应设有与（    ）相连的接地端，接地电阻应合格。,A-检修设备|B-接地网|C-带电设备|D-停电设备,B
172,专业题库,01单选题,依据变电安规，对由于设备原因，（    ）与检修设备之间连有断路器（开关），在接地刀闸（装置）和断路器（开关）合上后，在断路器（开关）操作把手上，应悬挂“禁止分闸！”的标示牌。,A-停电设备|B-接地刀闸（装置）|C-非检修设备|D-隔离开关(刀闸),B
173,专业题库,01单选题,依据变电安规，作业人员工作中正常活动范围与35kV设备带电部分的安全距离小于（　　）m时，设备应停电。,A-1.50|B-1.00|C-0.75|D-0.60,D
174,专业题库,01单选题,依据变电安规，与停电设备有关的变压器和电压互感器，应将设备（    ）断开，防止向停电检修设备反送电。,A-各侧|B-高压侧|C-低压侧|D-带电侧,A
175,专业题库,01单选题,依据变电安规，停电接地时，检修部分若分为几个在电气上不相连接的部分[如分段母线以隔离开关（刀闸）或断路器（开关）隔开分成几段]，则各段应（    ）。,A-分别验电接地短路|B-在来电侧接地短路|C-在来电侧验电接地短路|D-在母线侧接地短路,A
176,专业题库,01单选题,依据变电安规，对于因平行或邻近带电设备导致检修设备可能产生感应电压时，应加装（　　）。,A-标示牌|B-围栏|C-隔离挡板|D-工作接地线或使用个人保安线,D
177,专业题库,01单选题,依据变电安规，220kV设备验电时，人体应与验电设备保持（    ）m安全距离。,A-3.00|B-2.80|C-2.70|D-2.55,A
178,专业题库,01单选题,依据变电安规，对于可能送电至停电设备的（    ）都应装设接地线或合上接地刀闸（装置），所装接地线与带电部分应考虑接地线摆动时仍符合安全距离的规定。,A-线路侧|B-母线侧|C-各方面|D-负荷侧,C
179,专业题库,01单选题,依据变电安规，室外构架上工作，在作业人员上下铁架或梯子上，应悬挂（    ）的标示牌。,A-“禁止攀登，高压危险！”|B-“在此工作！”|C-“止步，高压危险！”|D-“从此上下！”,D
180,专业题库,01单选题,依据变电安规，接地线、接地刀闸与检修设备之间不得连有（    ）。,A-断路器(开关）或熔断器|B-断路器（开关）或隔离开关（刀闸）|C-任何设备|D-隔离开关(刀闸)或熔断器,A
181,专业题库,01单选题,依据变电安规，66kV、110kV设备验电时，人体应与验电设备保持（    ）m安全距离。,A-1.50|B-1.40|C-1.15|D-1.00,A
182,专业题库,01单选题,依据变电安规，在一经合闸即可送电到工作地点的断路器（开关）和隔离开关（刀闸）的操作把手上，均应悬挂（　　）的标示牌。,A-“禁止合闸，有人工作！”|B-“禁止合闸，线路有人工作！”|C-“禁止分闸！”|D-“禁止攀登，高压危险！”,A
183,专业题库,01单选题,依据变电安规，（　　）kV及以下设备可用与带电部分直接接触的绝缘隔板代替临时遮栏。,A-35|B-110|C-220|D-330,A
184,专业题库,01单选题,依据变电安规，装设接地线应（　　）。,"A-先接电源侧,后接负荷侧|B-先接导体端，后接接地端|C-先接接地端，后接导体端|D-先接负荷侧,后接电源侧",C
185,专业题库,01单选题,依据变电安规，在配电装置上，接地线应装在该装置（    ）的规定地点，应去除这些地点的油漆或绝缘层，并划有黑色标记。,A-导电部分|B-绝缘部分|C-裸露部分|D-检修部分,A
186,专业题库,01单选题,依据变电安规，直流换流站单极停电工作，应在双极公共区域设备与停电区域之间设置围栏，在围栏面向停电设备及运行阀厅门口悬挂（    ）标示牌。,A-“止步、高压危险！”|B-“从此进出！”|C-“在此工作！”|D-“禁止攀登，高压危险！”,A
187,专业题库,01单选题,依据变电安规，在门型构架的线路侧进行停电检修，如工作地点与所装接地线的距离小于（    ），工作地点虽在接地线外侧，也可不另装接地线。,A-10m|B-12m|C-14m|D-16m,A
188,专业题库,01单选题,依据变电安规，室外构架上工作，在邻近其他可能误登的带电构架上，应悬挂（　　）的标示牌。,A-“禁止攀登，高压危险！”|B-“在此工作！”|C-“止步，高压危险！”|D-“从此上下！”,A
189,专业题库,01单选题,依据变电安规，在室内高压设备上工作，应在工作地点两旁及对面运行设备间隔的遮栏（围栏）上和禁止通行的过道遮栏（围栏）上悬挂（    ）的标示牌。,A-“止步，高压危险！”|B-“从此进出！”|C-“禁止合闸！”|D-“在此工作！”,A
190,专业题库,01单选题,依据变电安规，采用间接验电判断时，至少应有（    ）的指示发生对应变化，且所有这些确定的指示均已同时发生对应变化，才能确认该设备已无电。,A-两个非同样原理或非同源|B-三个非同样原理或非同源|C-两个非同样原理和非同源|D-三个非同样原理和非同源,A
191,专业题库,01单选题,依据变电安规，验电时，应使用（    ），在装设接地线或合接地线刀闸（装置）处对各相分别验电。,A-不小于相应电压等级且合格的感应式验电器|B-相应电压等级且合格的接触式验电器|C-相应电压等级且合格的感应式验电器|D-不小于相应电压等级且合格的接触式验电器,B
192,专业题库,01单选题,依据变电安规，高压开关柜内手车开关拉出后，隔离带电部位的挡板封闭后禁止开启，并设置（    ）的标示牌。,A-“止步，高压危险！”|B-“禁止合闸，有人工作！”|C-“禁止合闸，线路有人工作！”|D-“在此工作！”,A
193,专业题库,01单选题,依据变电安规，高压回路上的工作，必须要拆除全部或一部分接地线后始能进行工作者，应征得（    ）的许可（根据调控人员指令装设的接地线，应征得调控人员的许可），方可进行。工作完毕后立即恢复。,A-工作票签发人|B-工作负责人|C-运维人员|D-监护人,C
194,专业题库,01单选题,依据变电安规，个人保安线由（    ）。,A-作业人员自装自拆|B-工作许可人装拆|C-工作负责人装拆|D-专责监护人装拆,A
195,专业题库,01单选题,依据变电安规，雨雪天气时不得进行（    ）验电。,A-室外直接|B-室内直接|C-室外间接|D-室内间接,A
196,专业题库,01单选题,依据变电安规，高压验电应（    ）。,A-戴线手套|B-穿防电弧服|C-戴护目眼镜|D-戴绝缘手套,D
197,专业题库,01单选题,依据变电安规，在室外构架上工作，则应在工作地点邻近带电部分的横梁上，悬挂（    ）的标示牌。,A-“禁止攀登，高压危险！”|B-“在此工作！”|C-“止步，高压危险！”|D-“从此上下！”,C
198,专业题库,01单选题,依据变电安规，在室外高压设备上工作，应在工作地点四周装设围栏，其出入口要围至临近道路旁边，并设有（    ）的标示牌。,A-“在此工作！” |B-“从此进出！”|C-“止步，高压危险！”|D-“从此上下！”,B
199,专业题库,01单选题,依据变电安规，直流换流站单极停电工作，在检修阀厅和直流场设备处设置（    ）的标示牌。,A-“止步、高压危险！”|B-“从此进出！”|C-“在此工作！”|D-“禁止攀登，高压危险！”,C
200,专业题库,01单选题,依据变电安规，作业人员工作中正常活动范围与110kV设备带电部分的安全距离小于（　　）m时，设备应停电。,A-1.5|B-1.75|C-1.80|D-2.00,A
201,专业题库,01单选题,依据变电安规，降压变电站全部停电时，应将各个可能来电侧的部分接地短路，其余部分不必每段都装设接地线或（    ）。,A-合上隔离开关|B-合上断路器|C-合上接地刀闸(装置)|D-临时接地线,C
202,专业题库,01单选题,依据变电安规，电缆及电容器接地前应逐相充分放电，星形接线电容器的中性点应接地，串联电容器及与整组电容器脱离的电容器（    ），装在绝缘支架上的电容器外壳也应放电。,A-应放电|B-应逐个多次放电|C-应一次性放电|D-不得放电,B
203,专业题库,01单选题,依据变电安规，作业人员工作中正常活动范围与220kV设备带电部分的安全距离小于（　　）m时，设备应停电。,A-3.00|B-3.35|C-3.50|D-4.00,A
204,专业题库,01单选题,依据变电安规，检修设备停电，应拉开隔离开关（刀闸），（    ）应拉至试验或检修位置，应使各方面有一个明显的断开点。,A-隔离开关(刀闸）|B-断路器（开关)|C-手车开关|D-保护切换开关,C
205,专业题库,01单选题,依据变电安规，在显示屏上进行操作的断路器（开关）和隔离开关（刀闸）的操作处应设置“禁止合闸，有人工作！”或“禁止合闸，线路有人工作！”以及（　　）的标记。,A-“止步，高压危险！”|B-“禁止分闸！”|C-“禁止合闸！” |D-“在此工作！”,B
206,专业题库,01单选题,依据变电安规，在手车开关拉出后，应观察隔离挡板是否可靠封闭。封闭式组合电器引出电缆备用孔或母线的终端备用孔应用（    ）封闭。,A-专用器具|B-临时隔板|C-接地隔板|D-绝缘隔板,A
207,专业题库,01单选题,依据变电安规，全部停电的工作，是指室内高压设备全部停电（包括架空线路与电缆引入线在内），并且通至邻接（    ）的门全部闭锁，以及室外高压设备全部停电（包括架空线路与电缆引入线在内）的工作。,A-保护室|B-蓄电池室|C-主控室|D-高压室,D
208,专业题库,01单选题,依据变电安规，待用间隔(母线连接排、引线已接上母线的备用间隔)应有名称、编号，并列入（    ）管辖范围。其隔离开关(刀闸)操作手柄、网门应加锁。,A-调度控制中心|B-设备运行单位|C-设备检修单位|D-设备维护单位,A
209,专业题库,01单选题,依据变电安规，高压室的钥匙至少应有（    ）把，由运维人员负责保管，按值移交。,A-1|B-2|C-3|D-4,C
210,专业题库,01单选题,依据变电安规，无论高压设备是否带电，作业人员不得单独移开或越过遮栏进行工作；若有必要移开遮栏时，应有（    ）在场，并符合设备不停电时的安全距离。,A-安全员|B-监护人|C-负责人|D-班组长,B
211,专业题库,01单选题,依据变电安规，在高压设备上工作，应至少由（    ）进行，并完成保证安全的组织措施和技术措施。,A-一人|B-两人|C-三人|D-四人,B
212,专业题库,01单选题,依据变电安规，无论高压设备是否带电，作业人员不得单独移开或越过遮栏进行工作；若有必要移开遮栏时，应有监护人在场，并符合（    ）的安全距离。,A-设备停电时|B-设备不停电时|C-作业时|D-带电作业时,B
213,专业题库,01单选题,依据变电安规，高压设备发生接地时，室内人员应距离故障点（    ）m以外。,A-1|B-2|C-3|D-4,D
214,专业题库,01单选题,依据变电安规，待用间隔(母线连接排、引线已接上母线的备用间隔)应有（    ），并列入调度控制中心管辖范围。,A-名称|B-编号|C-名称、编号|D-名称|E-序号,C
215,专业题库,01单选题,依据变电安规，高压设备发生接地时，室外人员应距离故障点（    ）m以外。,A-2|B-4|C-6|D-8,D
216,专业题库,01单选题,依据变电安规，户外220kV高压配电装置场所的行车通道上，车辆（包括装载物）外廓至无遮拦带电部分之间的安全距离为（    ）m。,A-2.55|B-2.35|C-2.25|D-1.75,A
217,专业题库,01单选题,依据变电安规，运行中的高压设备，其中性点接地系统的中性点应视作（    ）。,A-带电体|B-停电设备|C-检修设备|D-试验设备,A
218,专业题库,01单选题,依据变电安规，在高压设备上工作，应至少由两人进行，并完成保证安全的（    ）。,A-技术措施和应急措施|B-组织措施和现场措施|C-组织措施和技术措施|D-应急措施和现场措施,C
219,专业题库,01单选题,依据变电安规，雷雨天气，需要巡视室外高压设备时，应穿（    ），并不准靠近避雷器和避雷针。,A-雨鞋|B-绝缘靴|C-橡胶鞋|D-绝缘鞋,B
220,专业题库,01单选题,依据变电安规，换流站阀厅未转（　　）前，人员禁止进入作业（巡视通道除外）。,A-运行|B-检修|C-冷备用|D-热备用,B
221,专业题库,01单选题,依据变电安规，待用间隔(母线连接排、引线已接上母线的备用间隔)应有名称、编号，并列入调度控制中心管辖范围。其隔离开关(刀闸)操作手柄、网门应（    ）。,A-加锁|B-悬挂标示牌|C-设遮拦|D-不再加锁,A
222,专业题库,01单选题,依据变电安规，换流站内，运行中高压直流系统直流场中性区域设备、站内临时接地极、接地极线路及接地极均应视为（　　）。,A-非带电体|B-带电体|C-部分带电体|D-绝缘体,B
223,专业题库,01单选题,依据变电安规，地震、台风、洪水、泥石流等灾害发生后，如需要对设备进行巡视时，应制定必要的安全措施，得到（    ）批准，并至少两人一组，巡视人员应与派出部门之间保持通信联络。,A-调控人员|B-设备运维管理单位|C-安监部门|D-分管领导,B
224,专业题库,01单选题,依据变电安规，触电急救，胸外心脏按压频率应保持在（　　）次/min。,A-60|B-80|C-100|D-120,C
225,专业题库,01单选题,依据变电安规，触电伤员脱离电源后，正确的抢救体位是（　　）。,A-左侧卧位|B-右侧卧位|C-仰卧位|D-俯卧位,C
226,专业题库,01单选题,依据变电安规，触电急救应分秒必争，一经明确心跳、呼吸停止的，立即就地迅速用（　　）进行抢救，并坚持不断地进行，同时及早与医疗急救中心（医疗部门）联系，争取医务人员接替救治。,A-心脏按压法|B-口对口呼吸法|C-口对鼻呼吸法|D-心肺复苏法,D
227,专业题库,01单选题,依据变电安规，触电急救脱离电源，就是要把触电者接触的那一部分带电设备的（　　）断路器（开关）、隔离开关（刀闸）或其他断路设备断开；或设法将触电者与带电设备脱离开。,A-有关|B-所有|C-高压|D-低压,B
228,专业题库,01单选题,依据变电安规，紧急救护时，发现伤员意识不清、瞳孔扩大无反应、呼吸、心跳停止时，应立即在现场就地抢救，用（　　）支持呼吸和循环，对脑、心重要脏器供氧。,A-心脏按压法|B-口对口呼吸法|C-口对鼻呼吸法|D-心肺复苏法,D
229,专业题库,01单选题,依据变电安规，进行心肺复苏法时，如有担架搬运伤员，应该持续做心肺复苏，中断时间不超过（　　）s。,A-5|B-10|C-30|D-60,A
230,专业题库,01单选题,依据变电安规，触电急救，当采用胸外心脏按压法进行急救时，伤员应仰卧于（　　）上。,A-柔软床垫|B-硬板床或地|C-担架|D-弹簧床,B
231,专业题库,01单选题,依据变电安规，触电急救，在医务人员（　　）前，不得放弃现场抢救，更不能只根据没有呼吸或脉搏的表现，擅自判定伤员死亡，放弃抢救。,A-未到达|B-未接替救治|C-作出死亡诊断|D-判断呼吸或脉搏表现,B
232,专业题库,01单选题,依据变电安规，SF6配电装置室与其下方电缆层、电缆隧道相通的孔洞都应封堵.SF6配电装置室及下方电缆层隧道的门上，应设置“（    ）”的标志。,A-注意危险|B-严禁烟火|C-注意通风|D-禁止吸烟,C
233,专业题库,01单选题,依据变电安规，在SF6配电装置室低位区应安装能报警氧量仪和SF6气体泄漏报警仪，在工作人员入口处应装设显示器.上述仪器应（    ），保证完好。,A-定期检验|B-不定期检验|C-专人巡视检查|D-定期更换,A
234,专业题库,01单选题,依据变电安规，设备内的SF6气体不准向大气排放，应采取净化装置回收，经处理检测合格后方准再使用。回收时作业人员应站在（    ）。,A-上风侧|B-下风侧|C-设备上方|D-设备下方,A
235,专业题库,01单选题,依据变电安规，在SF6配电装置室低位区应安装（    ），在工作人员入口处应装设显示器。,A-氧量仪和SF6气体泄漏报警仪|B-氧量仪和SF6气体泄漏测试仪|C-能报警的氧量仪和SF6气体泄漏报警仪|D-能显示含氧量的氧量仪和SF6气体泄漏报警仪,C
236,专业题库,01单选题,依据变电安规，在室内，设备充装SF6气体时，工作区空气中SF6气体含量不得超过（    ）μL/L。,A-1000|B-1100|C-1200|D-1300,A
237,专业题库,01单选题,依据变电安规，在室内，设备充装SF6气体时，周围环境相对湿度应不大于（    ），同时应开启通风系统，并避免SF6气体泄漏到工作区。,A-80%|B-85%|C-90%|D-95%,A
238,专业题库,01单选题,依据变电安规，SF6配电装置发生大量泄漏等紧急情况时，人员应迅速撤出现场，开启所有排风机进行排风。未佩戴（    ）人员禁止入内。,A-防毒面具或口罩|B-防毒面具或正压式空气呼吸器|C-口罩或正压式空气呼吸器|D-护目眼镜或正压式空气呼吸器,B
239,专业题库,01单选题,依据变电安规，工作人员进入SF6配电装置室，入口处若无SF6气体含量显示器，应先通风（    ）min，并用检漏仪测量SF6气体含量合格。,A-8|B-10|C-12|D-15,D
240,专业题库,01单选题,依据变电安规，装有SF6设备的配电装置室和SF6气体实验室，应装设强力通风装置，风口应设置在室内（    ），排风口不应朝向居民住宅或行人。,A-顶部|B-底部|C-中部|D-上部,B
241,专业题库,01单选题,依据变电安规，SF6配电装置发生防爆膜破裂时，应停电处理，并用（    ）擦拭干净。,A-汽油或丙酮|B-煤油或丙酮|C-汽油或酒精|D-汽油或香蕉水,A
242,专业题库,01单选题,依据变电安规，SF6设备解体检修，打开设备封盖后，现场所有人员应暂离现场（    ）min。,A-30|B-20|C-15|D-10,A
243,专业题库,01单选题,依据变电安规，进行气体采样和处理一般渗漏时，要戴（    ）并进行通风。,A-防毒面具或口罩|B-口罩或正压式空气呼吸器|C-防毒面具或正压式空气呼吸器|D-护目眼镜或正压式空气呼吸器,C
244,专业题库,01单选题,依据变电安规，单人操作、检修人员在倒闸操作过程中（　　）解锁。,A-可以|B-禁止|C-在有人监护情况下|D-站长同意后,B
245,专业题库,01单选题,依据变电安规，检修人员操作时，操作票应由（　　）审核签名，然后才能使用。,A-运维负责人|B-工作负责人|C-班站长|D-技术员,B
246,专业题库,01单选题,依据变电安规，经设备运维管理单位考试合格并批准的本单位的检修人员，可进行（    ）及以下的电气设备由热备用至检修或由检修至热备用的监护操作，监护人应是同一单位的检修人员或设备运维人员。,A-220kV|B-330kV|C-500kV|D-750kV,A
247,专业题库,01单选题,依据变电安规，在低压配电装置和低压导线上工作，作业前，应先分清相线、零线，选好工作位置。断开导线时，应（    ）。搭接导线时，顺序应相反。,A-先断开相线，后断开零线|B- 先断开零线，后断开相线|C-同时断开相线和零线|D-先断开中相，后断开边相,A
248,专业题库,01单选题,依据变电安规，停电更换熔断器后，恢复操作时，应（    ）。,A-戴手套|B-戴护目眼镜|C-戴手套和护目眼镜|D-穿防电弧服,C
249,专业题库,01单选题,依据变电安规，低压带电工作时，应采取遮蔽（    ）等防止相间或接地短路的有效措施；若无法采取遮蔽措施时，则将影响作业的有电设备停电。,A-导体部分|B-有电部分|C-停电部分|D-金属部分,B
250,专业题库,01单选题,依据变电安规，低压电气带电工作应（    ），并保持对地绝缘。,A-戴手套|B-戴护目眼镜|C-戴手套、护目眼镜|D-戴手套、穿防电弧服,C
251,专业题库,01单选题,依据变电安规，工作前应详细核对电缆标志牌的（    ）与工作票所填写的相符，安全措施正确可靠后，方可开始工作。,A-名称|B-编号|C-走向|D-型号,A
252,专业题库,01单选题,依据变电安规，进入电缆井、电缆隧道前，应先用吹风机排除浊气，再用（　　）检查井内或隧道内的易燃易爆及有毒气体的含量是否超标，并作好记录。,A-气体检测仪|B-仪表|C-小动物|D-明火,A
253,专业题库,01单选题,依据变电安规，填用电力电缆第一种工作票的工作应该经（　　）许可。,A-运维人员|B-调控人员|C-工区领导|D-工作负责人,B
254,专业题库,01单选题,依据变电安规，电力电缆试验要拆除接地线时，应征得（    ）的许可（根据调控人员指令装设的接地线，应征得调控人员的许可），方可进行。,A-工作许可人|B-工作负责人|C-工作票签发人|D-试验小组负责人,A
255,专业题库,01单选题,依据变电安规，电缆直埋敷设施工前应先查清（    ），再开挖足够数量的样洞和样沟，摸清地下管线分布情况，以确定电缆敷设位置及确保不损坏运行电缆和其他地下管线。,A-图纸|B-电缆运行记录|C-历史资料|D-电缆出厂资料,A
256,专业题库,01单选题,依据变电安规，在开断电缆以前，应与电缆走向图图纸核对相符，并使用专用仪器（如感应法）确切证实电缆无电后，用（    ）钉入电缆芯后，方可工作。,A-带绝缘柄的铁钎|B-接地的铁钎|C-接地的带绝缘柄的铁钎|D-接地的带手柄的铁钎,C
257,专业题库,01单选题,依据变电安规，在10kV跌落式熔断器上桩头有电的情况下，如必须进行工作，则应采用专用绝缘罩隔离，在下桩头加装接地线。作业人员站在低位，伸手不得超过跌落式熔断器（　　），并设专人监护。,A-上桩头|B-中间位置|C-下桩头|D-横担位置,C
258,专业题库,01单选题,依据变电安规，在10kV跌落式熔断器与10kV电缆头之间，宜加装（　　）装置，使工作时能与跌落式熔断器上桩头有电部分保持安全距离。,A-过渡连接|B-接地|C-绝缘|D-灭弧,A
259,专业题库,01单选题,依据变电安规，电力电缆作业，使用远控电缆割刀开断电缆时，刀头应（    ），周边其他施工人员应临时撤离，远控操作人员应与刀头保持足够的安全距离，防止弧光和跨步电压伤人。,A-可靠绝缘|B-可靠接地|C-装设护套|D-垂直向下,B
